{
  "$schema": "../schema/fixture.schema.json",
  "feature": "storage",
  "spec": "features/storage.md",
  "status": {
    "web": "pass",
    "ios": "pass",
    "android": "pass"
  },
  "cases": [
    {
      "name": "parse valid list",
      "op": "parseStoredTodos",
      "given": {
        "raw": "[{\"id\":\"a\",\"title\":\"Buy milk\",\"completed\":false,\"priority\":\"high\",\"createdAt\":\"2026-01-01T09:00:00.000Z\",\"updatedAt\":\"2026-01-05T09:00:00.000Z\",\"notes\":\"2% organic\"},{\"id\":\"b\",\"title\":\"Walk the dog\",\"completed\":true,\"priority\":\"medium\",\"createdAt\":\"2026-01-02T09:00:00.000Z\",\"updatedAt\":\"2026-01-05T09:00:00.000Z\"},{\"id\":\"c\",\"title\":\"Call mom\",\"completed\":false,\"priority\":\"low\",\"createdAt\":\"2026-01-03T09:00:00.000Z\",\"updatedAt\":\"2026-01-05T09:00:00.000Z\",\"dueDate\":\"2026-01-06\"}]"
      },
      "then": [
        {
          "id": "new-1",
          "title": "Buy milk",
          "completed": false,
          "priority": "high",
          "createdAt": "2026-01-01T09:00:00.000Z",
          "updatedAt": "2026-01-05T09:00:00.000Z",
          "notes": "2% organic"
        },
        {
          "id": "new-2",
          "title": "Walk the dog",
          "completed": true,
          "priority": "medium",
          "createdAt": "2026-01-02T09:00:00.000Z",
          "updatedAt": "2026-01-05T09:00:00.000Z"
        },
        {
          "id": "new-3",
          "title": "Call mom",
          "completed": false,
          "priority": "low",
          "createdAt": "2026-01-03T09:00:00.000Z",
          "updatedAt": "2026-01-05T09:00:00.000Z",
          "dueDate": "2026-01-06"
        }
      ]
    },
    {
      "name": "parse null",
      "op": "parseStoredTodos",
      "given": {
        "raw": null
      },
      "then": []
    },
    {
      "name": "parse empty string",
      "op": "parseStoredTodos",
      "given": {
        "raw": ""
      },
      "then": []
    },
    {
      "name": "parse corrupt JSON",
      "op": "parseStoredTodos",
      "given": {
        "raw": "[{oops"
      },
      "then": []
    },
    {
      "name": "parse non-array JSON",
      "op": "parseStoredTodos",
      "given": {
        "raw": "{\"id\":\"a\"}"
      },
      "then": []
    },
    {
      "name": "serialize round-trips",
      "op": "serializeTodos",
      "given": {
        "todos": [
          {
            "id": "a",
            "title": "Buy milk",
            "completed": false,
            "priority": "high",
            "createdAt": "2026-01-01T09:00:00.000Z",
            "updatedAt": "2026-01-05T09:00:00.000Z",
            "notes": "2% organic"
          },
          {
            "id": "b",
            "title": "Walk the dog",
            "completed": true,
            "priority": "medium",
            "createdAt": "2026-01-02T09:00:00.000Z",
            "updatedAt": "2026-01-05T09:00:00.000Z"
          },
          {
            "id": "c",
            "title": "Call mom",
            "completed": false,
            "priority": "low",
            "createdAt": "2026-01-03T09:00:00.000Z",
            "updatedAt": "2026-01-05T09:00:00.000Z",
            "dueDate": "2026-01-06"
          }
        ]
      },
      "then": [
        {
          "id": "a",
          "title": "Buy milk",
          "completed": false,
          "priority": "high",
          "createdAt": "2026-01-01T09:00:00.000Z",
          "updatedAt": "2026-01-05T09:00:00.000Z",
          "notes": "2% organic"
        },
        {
          "id": "b",
          "title": "Walk the dog",
          "completed": true,
          "priority": "medium",
          "createdAt": "2026-01-02T09:00:00.000Z",
          "updatedAt": "2026-01-05T09:00:00.000Z"
        },
        {
          "id": "c",
          "title": "Call mom",
          "completed": false,
          "priority": "low",
          "createdAt": "2026-01-03T09:00:00.000Z",
          "updatedAt": "2026-01-05T09:00:00.000Z",
          "dueDate": "2026-01-06"
        }
      ]
    },
    {
      "name": "parse keeps recurrence",
      "op": "parseStoredTodos",
      "given": {
        "raw": "[{\"id\":\"r\",\"title\":\"Gym\",\"completed\":false,\"priority\":\"medium\",\"createdAt\":\"2026-01-05T09:00:00.000Z\",\"updatedAt\":\"2026-01-05T09:00:00.000Z\",\"recurrence\":\"weekly\",\"dueDate\":\"2026-01-05\"}]"
      },
      "then": [
        {
          "id": "new-1",
          "title": "Gym",
          "completed": false,
          "priority": "medium",
          "createdAt": "2026-01-05T09:00:00.000Z",
          "updatedAt": "2026-01-05T09:00:00.000Z",
          "recurrence": "weekly",
          "dueDate": "2026-01-05"
        }
      ]
    },
    {
      "name": "parse keeps completedAt",
      "op": "parseStoredTodos",
      "given": {
        "raw": "[{\"id\":\"a\",\"title\":\"Todo a\",\"completed\":true,\"priority\":\"medium\",\"createdAt\":\"2026-01-05T09:00:00.000Z\",\"updatedAt\":\"2026-01-05T10:00:00.000Z\",\"completedAt\":\"2026-01-05T10:00:00.000Z\"},{\"id\":\"b\",\"title\":\"Todo b\",\"completed\":false,\"priority\":\"medium\",\"createdAt\":\"2026-01-05T09:00:00.000Z\",\"updatedAt\":\"2026-01-05T09:00:00.000Z\"}]"
      },
      "then": [
        {
          "id": "new-1",
          "title": "Todo a",
          "completed": true,
          "priority": "medium",
          "createdAt": "2026-01-05T09:00:00.000Z",
          "updatedAt": "2026-01-05T10:00:00.000Z",
          "completedAt": "2026-01-05T10:00:00.000Z"
        },
        {
          "id": "new-2",
          "title": "Todo b",
          "completed": false,
          "priority": "medium",
          "createdAt": "2026-01-05T09:00:00.000Z",
          "updatedAt": "2026-01-05T09:00:00.000Z"
        }
      ]
    },
    {
      "name": "sort preference key",
      "op": "sortStorageKey",
      "given": {},
      "then": "todo-tracker:sort:v1"
    },
    {
      "name": "parseStoredSort: manual",
      "op": "parseStoredSort",
      "given": {
        "raw": "manual"
      },
      "then": "manual"
    },
    {
      "name": "parseStoredSort: priority",
      "op": "parseStoredSort",
      "given": {
        "raw": "priority"
      },
      "then": "priority"
    },
    {
      "name": "parseStoredSort: missing falls back to priority",
      "op": "parseStoredSort",
      "given": {
        "raw": null
      },
      "then": "priority"
    },
    {
      "name": "parseStoredSort: unknown falls back to priority",
      "op": "parseStoredSort",
      "given": {
        "raw": "bogus"
      },
      "then": "priority"
    }
  ]
}
